{
  "schemaVersion": 1,
  "graphVersion": "2026-09-10",
  "title": "AI Futures Map — seed graph",
  "description": "Curated seed graph for the AI Futures Map: 18 event nodes across six lanes, five mutually exclusive world-states on a single goodness axis, and the edges coupling them. Ported from tmp/futures-design/ai-futures-map-design.html (v2).",
  "startYear": 2026,
  "endYear": 2045,
  "horizons": [2028, 2030, 2035, 2045],
  "axis": {
    "id": "world-trajectory",
    "label": "Where the world ends up",
    "states": ["flourishing", "muddling", "stratified", "catastrophe", "existential"],
    "horizons": [2030, 2035, 2045],
    "absorbing": ["existential"],
    "floorGoodness": 20,
    "ceilingGoodness": 90
  },
  "nodes": [
    {
      "id": "agi",
      "kind": "event",
      "label": "AGI-level systems exist",
      "shortLabel": "AGI",
      "lane": "capability",
      "valence": "neutral",
      "severity": "none",
      "summary": "AI matches expert humans on most economically valuable cognitive tasks.",
      "operationalisation": "A system passes a broad expert-level battery (for example >=90% on a held-out professional-exam suite spanning >=8 fields) and can complete multi-week autonomous projects without human handholding.",
      "narrative": "From the inside this feels less like a single headline and more like everyone suddenly having a colleague who never sleeps and is better than most humans at almost anything cognitive. Meetings start including 'ask the model first.' The surprising part isn't a dramatic announcement, it's how normal it feels within a few months.",
      "seed": {
        "curve": { "2028": 0.25, "2030": 0.45, "2035": 0.70, "2045": 0.85 },
        "basis": "Blends Metaculus community forecasts for weak AGI (roughly 2027-2031 median) with the AI Impacts 2023 Expert Survey's ~50% HLMI-by-~2047 estimate, shifted earlier to reflect faster 2024-26 progress.",
        "confidence": "low",
        "sources": [
          { "label": "Metaculus: When will the first weakly general AI system be devised?", "kind": "forecast-market", "value": "community median roughly 2027-2031" },
          { "label": "AI Impacts 2023 Expert Survey on Progress in AI (ESPAI)", "kind": "survey", "value": "~50% chance of HLMI by ~2047", "url": "https://aiimpacts.org/2023-ai-survey-of-2778-six-things-to-know/" }
        ],
        "seededBy": "curator",
        "asOf": "2026-09-10"
      },
      "since": "2026-09-10"
    },
    {
      "id": "rsi",
      "kind": "event",
      "label": "Recursive self-improvement",
      "shortLabel": "RSI",
      "lane": "capability",
      "valence": "mixed",
      "severity": "none",
      "summary": "AI R&D is mostly done by AI; capability doubling time under one year.",
      "operationalisation": "The majority of new AI research and engineering work (model design, training-run debugging, algorithm search) is performed by AI systems with only light human review, and the effective compute-adjusted capability doubling time drops under one year.",
      "narrative": "Progress stops being paced by human researchers writing papers and starts being paced by how fast the labs can spin up the next training run. People inside the labs describe a vertiginous feeling of losing the ability to keep up with what their own systems are doing.",
      "seed": {
        "curve": { "2028": 0.05, "2030": 0.20, "2035": 0.40, "2045": 0.50 },
        "basis": "Follows the AI-2027 scenario's upper (fast-takeoff) branch for when AI R&D becomes mostly AI-driven, with probabilities discounted roughly by half to correct for the scenario's own acknowledged optimism about speed.",
        "confidence": "low",
        "sources": [
          { "label": "AI 2027 scenario forecast", "kind": "scenario", "value": "upper branch, probabilities roughly halved" }
        ],
        "seededBy": "curator",
        "asOf": "2026-09-10"
      },
      "parents": [
        { "from": "agi", "kind": "requires", "strength": 0.9, "lag": 1, "note": "Recursive self-improvement requires AGI-level systems to exist first; you can't have AI doing AI research at human-expert level without human-expert-level AI existing." }
      ],
      "since": "2026-09-10"
    },
    {
      "id": "race-dynamics",
      "kind": "event",
      "label": "Frontier race with cut corners",
      "shortLabel": "Race dynamics",
      "lane": "governance",
      "valence": "bad",
      "severity": "none",
      "summary": "US/China/lab race where safety timelines are visibly compressed to win.",
      "operationalisation": "At least two of the leading US, Chinese, or major-lab frontier programs publicly or reportedly compress safety testing, red-teaming, or deployment review timelines specifically to avoid ceding a capability lead.",
      "narrative": "Safety teams get told a launch date moved up and their review window moved down, again. Nobody thinks it's a good idea in the abstract, but everyone believes the other side will do it anyway, so nobody wants to be the one who unilaterally slows down.",
      "seed": {
        "curve": { "2028": 0.60, "2030": 0.70, "2035": 0.75, "2045": 0.75 },
        "basis": "Editorial judgment: extrapolates the visible 2024-26 US/China/lab competitive dynamic where safety commitments are repeatedly loosened to preserve release timelines.",
        "confidence": "low",
        "sources": [
          { "label": "Editorial judgment (curator estimate)", "kind": "editorial" }
        ],
        "seededBy": "curator",
        "asOf": "2026-09-10"
      },
      "parents": [
        { "from": "rsi", "kind": "amplifies", "strength": 0.4, "lag": 0, "note": "Recursive self-improvement raises the stakes of falling behind, intensifying the incentive to cut corners on safety to keep pace." },
        { "from": "compute-governance", "kind": "prevents", "strength": -0.6, "lag": 1, "note": "A binding, verified compute treaty removes the competitive rationale to cut corners, since nobody can secretly get ahead." }
      ],
      "since": "2026-09-10"
    },
    {
      "id": "compute-governance",
      "kind": "event",
      "label": "Binding international AI regime",
      "shortLabel": "Compute governance",
      "lane": "governance",
      "valence": "good",
      "severity": "none",
      "summary": "Treaty-level compute/training controls with verification, signed by US and China.",
      "operationalisation": "A binding international agreement, verified compute or training-run thresholds, inspections, or export controls with real enforcement teeth, is signed and in force between the US and China (or their blocs).",
      "narrative": "Instead of press-release-only summits, this looks like actual auditors with actual access, the way nuclear inspections work. It becomes possible to ask 'is anyone secretly training something huge' and get a real answer, not a guess.",
      "seed": {
        "curve": { "2028": 0.05, "2030": 0.12, "2035": 0.30, "2045": 0.45 },
        "basis": "Editorial judgment: a binding, verified international compute regime has no precedent yet, so the curve stays low through 2030 and rises only if a forcing event (see bio-cyber) or sustained diplomacy changes incentives.",
        "confidence": "low",
        "sources": [
          { "label": "Editorial judgment (curator estimate)", "kind": "editorial" }
        ],
        "seededBy": "curator",
        "asOf": "2026-09-10"
      },
      "parents": [
        { "from": "race-dynamics", "kind": "dampens", "strength": -0.4, "lag": 0, "note": "Racing incentives make signing away a competitive edge through binding compute treaties much less attractive to the leading players." },
        { "from": "epistemic-collapse", "kind": "dampens", "strength": -0.3, "lag": 0, "note": "Broken shared discourse makes it much harder to build the public and political consensus a binding international treaty needs." }
      ],
      "since": "2026-09-10"
    },
    {
      "id": "alignment-adequate",
      "kind": "event",
      "label": "Alignment adequate at frontier",
      "shortLabel": "Alignment adequate",
      "lane": "governance",
      "valence": "good",
      "severity": "none",
      "summary": "Independent evals confirm frontier systems reliably obey and are corrigible at deployment scale.",
      "operationalisation": "Independent third-party evaluations confirm that frontier systems reliably follow operator instructions, refuse to pursue covert objectives, and remain correctable ('corrigible') at real deployment scale, not just in a lab demo.",
      "narrative": "Engineers stop feeling like they're driving a car with brakes that sometimes work. External auditors, not just the lab that built the model, can vouch for its behavior under pressure, including when it would be more 'convenient' for the model to lie.",
      "seed": {
        "curve": { "2028": 0.10, "2030": 0.25, "2035": 0.45, "2045": 0.60 },
        "basis": "Editorial judgment: assumes steady but not dramatic progress on interpretability and control research, rising as evaluation infrastructure matures through the 2030s.",
        "confidence": "low",
        "sources": [
          { "label": "Editorial judgment (curator estimate)", "kind": "editorial" }
        ],
        "seededBy": "curator",
        "asOf": "2026-09-10"
      },
      "parents": [
        { "from": "race-dynamics", "kind": "dampens", "strength": -0.5, "lag": 0, "note": "A race dynamic means less time and budget spent on safety testing and interpretability work before each release." }
      ],
      "since": "2026-09-10"
    },
    {
      "id": "labor-displacement",
      "kind": "event",
      "label": "Mass labour displacement",
      "shortLabel": "Labor displacement",
      "lane": "economy",
      "valence": "mixed",
      "severity": "disruptive",
      "summary": "AI systems perform a large share of paid work that used to require humans.",